place_id,name,address,lat,lng,distance_miles,facility_size_acres,building_count,bay_count,trucks_visible,trailers_visible,cleanliness_score,building_condition,has_signage,has_fencing,lot_organized,facility_type,analysis_notes,image_path,analyzed_at
ChIJU-3eUNNiaYgRGzDcFXx-zKY,Don's Trucks Sales,"402 Colonels Way, Henryville, IN 47126, USA",38.540472699999995,-85.77478649999999,23.0,2.5,4,6,10,40,4,5,False,False,False,storage_yard,"The facility appears to be primarily a storage yard for trucks and trailers. The lot is not well-organized and appears somewhat cluttered. Building conditions are average, and there is no visible signage or fencing.",/Users/justinfagan/dev/reseller-intel/facility-images/ChIJU-3eUNNiaYgRGzDcFXx-zKY.jpg,2026-03-30T16:03:57.756166
ChIJ3fuSvJhPaYgRW3QJlT-WHuk,Ascendance Truck Centers,"13450 IN-135, Palmyra, IN 47164, USA",38.396906699999995,-86.1111737,23.1,4.5,3,15,20,10,7,8,False,False,True,dealer,"This facility appears to be a truck dealership with a service center. The lot is fairly organized with trucks and trailers parked in designated areas. The buildings appear to be in good condition, and there are multiple service bays visible.",/Users/justinfagan/dev/reseller-intel/facility-images/ChIJ3fuSvJhPaYgRW3QJlT-WHuk.jpg,2026-03-30T16:04:01.278215
ChIJ8_7iaBJPaYgRSfN8G-FVrG4,Kings Diesel LLC,"640 Main St, Palmyra, IN 47164, USA",38.4087439,-86.1116776,23.6,0.7,2,4,2,0,6,7,False,False,False,repair_shop,The facility appears to be a diesel repair shop with a main building and a smaller outbuilding. There are a few trucks parked on the lot. The lot appears somewhat unorganized.,/Users/justinfagan/dev/reseller-intel/facility-images/ChIJ8_7iaBJPaYgRSfN8G-FVrG4.jpg,2026-03-30T16:04:04.626632
ChIJHRXKOiOOaYgRkMdYme9BhxA,NAPA Auto Parts,"405 Yager Ave, La Grange, KY 40031, USA",38.404188999999995,-85.378569,24.7,1.2,2,6,0,0,7,7,False,False,True,parts_warehouse,"The facility appears to be a parts warehouse with a decent sized lot. There are several bays visible, suggesting loading/unloading operations. The lot appears organized and relatively clean.",/Users/justinfagan/dev/reseller-intel/facility-images/ChIJHRXKOiOOaYgRkMdYme9BhxA.jpg,2026-03-30T16:04:07.992753
ChIJnfigSHjBaYgRbJPA0BnhvwM,Shelby Diesel & Machine Repair,"400 Isaac Shelby Dr, Shelbyville, KY 40065, USA",38.2020027,-85.2731391,26.4,3.5,4,10,3,15,6,7,False,False,False,repair_shop,"The facility appears to be a truck repair shop with multiple buildings and service bays. There are several trailers parked on the lot, and the overall cleanliness and organization are moderate. No visible signage or fencing is present.",/Users/justinfagan/dev/reseller-intel/facility-images/ChIJnfigSHjBaYgRbJPA0BnhvwM.jpg,2026-03-30T16:04:11.559472
ChIJR_BqPVUpaYgRK4eeQ86MKbE,NAPA Auto Parts - Brandenburg Auto Parts,"140 Moremen Rd, Brandenburg, KY 40108, USA",37.992061899999996,-86.1604109,26.4,3.5,5,6,0,0,6,7,True,False,True,parts_warehouse,"This facility appears to be a parts warehouse with multiple buildings. The lot is relatively organized, and the buildings seem to be in decent condition. There are several bays visible, suggesting loading/unloading operations.",/Users/justinfagan/dev/reseller-intel/facility-images/ChIJR_BqPVUpaYgRK4eeQ86MKbE.jpg,2026-03-30T16:04:15.049748
ChIJe2TzZnL9aIgR6bjR1Q9w8gw,Southern Tire Mart at Pilot,"264 Plaza Park Rd, Lebanon Junction, KY 40150, USA",37.8259885,-85.72419049999999,26.5,4.5,2,6,10,15,7,7,False,True,True,service_center,"This facility appears to be a truck service center with a main building and a smaller storage building. The lot is mostly organized with designated parking for trucks and trailers. There is fencing around the perimeter, but no visible signage from the satellite view.",/Users/justinfagan/dev/reseller-intel/facility-images/ChIJe2TzZnL9aIgR6bjR1Q9w8gw.jpg,2026-03-30T16:04:18.066854
ChIJhyPxBVHV80YRiSZzfPMYfR8,Quality 1st truck and trailer repair,"13345 Preston Hwy, Lebanon Junction, KY 40150, USA",37.824549499999996,-85.7093754,26.7,2.5,4,5,0,2,4,6,False,False,False,repair_shop,"The facility appears to be a truck and trailer repair shop. There are multiple buildings, including what looks like a main shop building with several bays. The lot appears somewhat cluttered and disorganized, with some visible debris.",/Users/justinfagan/dev/reseller-intel/facility-images/ChIJhyPxBVHV80YRiSZzfPMYfR8.jpg,2026-03-30T16:04:21.457499
ChIJPw-aSwXAaYgRIUUrVzE4uT0,Bailey's Service Center,"490 Hill-N-Dale Dr, Shelbyville, KY 40065, USA",38.2138753,-85.2634198,26.9,0.5,0,0,0,0,5,0,False,False,False,other,"The satellite image shows a grassy field with some trees and what appears to be the remnants of a previous structure. There are no visible buildings or trucks, so it's difficult to determine the current use of the property. It is adjacent to residential properties.",/Users/justinfagan/dev/reseller-intel/facility-images/ChIJPw-aSwXAaYgRIUUrVzE4uT0.jpg,2026-03-30T16:04:24.928608
ChIJiVP8KkltaYgRkKrSiL0svz8,Big M Chevrolet,"704 N Dixie Blvd, Radcliff, KY 40160, USA",37.8471471,-85.9440939,26.9,4.5,1,6,0,0,7,7,True,False,True,dealer,"The facility appears to be a car dealership, with a large building and organized parking for many vehicles. There are several service bays visible. The lot appears relatively clean and well-maintained.",/Users/justinfagan/dev/reseller-intel/facility-images/ChIJiVP8KkltaYgRkKrSiL0svz8.jpg,2026-03-30T16:04:28.303767
ChIJJx3krwDAaYgRrssTvjb7PpY,"U S Trailer Center, LLC","102 Taylorsville Rd, Shelbyville, KY 40065, USA",38.2125051,-85.26153479999999,27.0,5.5,3,10,0,75,6,7,False,False,True,dealer,"This facility appears to be a trailer dealership, with a large number of trailers parked in organized rows. There are multiple buildings on the property, including one with several service bays. The lot appears moderately clean and organized.",/Users/justinfagan/dev/reseller-intel/facility-images/ChIJJx3krwDAaYgRrssTvjb7PpY.jpg,2026-03-30T16:04:32.315962
ChIJ8Z4XCkIpaYgRSFqGqAbvpYU,Ray's Ford Chrysler Dodge Jeep Ram,"385 Bypass Rd, Brandenburg, KY 40108, USA",37.979627,-86.16092069999999,27.0,4.0,2,6,0,0,7,7,False,False,True,dealer,"The facility appears to be a car dealership with a large inventory of vehicles. The lot is generally organized, and the buildings appear to be in decent condition. There is no visible signage or fencing.",/Users/justinfagan/dev/reseller-intel/facility-images/ChIJ8Z4XCkIpaYgRSFqGqAbvpYU.jpg,2026-03-30T16:04:35.782295
ChIJO6iNwhfeaIgR4KszgEiSC1o,"Finny's Complete Auto Repair - Luxury Imports & Exotics Specialists - BMW, Mercedes & More","466 N Dixie Blvd, Radcliff, KY 40160, USA",37.8443773,-85.9420215,27.1,2.5,4,6,0,0,6,6,True,False,True,repair_shop,"The facility appears to be a car repair shop with multiple buildings and service bays. The lot is mostly organized, and the building conditions are average. No large trucks or trailers are visible.",/Users/justinfagan/dev/reseller-intel/facility-images/ChIJO6iNwhfeaIgR4KszgEiSC1o.jpg,2026-03-30T16:04:39.138006
ChIJTxi42NzBaYgRttOx7SAITuo,Virgilio's Auto and Diesel Repair,"215 Enterprise Ct, Shelbyville, KY 40065, USA",38.1861379,-85.25958949999999,27.2,2.5,3,0,0,15,7,8,False,False,True,storage_yard,"The facility consists of three large buildings and a parking area. There are many trailers parked in an organized manner. The facility appears to be well-maintained, but there is no visible signage.",/Users/justinfagan/dev/reseller-intel/facility-images/ChIJTxi42NzBaYgRttOx7SAITuo.jpg,2026-03-30T16:04:42.536731
ChIJ6dRGcsYraYgRyaqUTCcaufI,Davidson Trailer Service,"1116 High St, Brandenburg, KY 40108, USA",37.993609299999996,-86.1811172,27.3,1.5,3,6,0,2,4,5,False,False,False,repair_shop,"The facility appears to be a truck/trailer repair shop. There are several service bays visible on the main building. The lot appears somewhat cluttered and disorganized, with trailers and equipment scattered around.",/Users/justinfagan/dev/reseller-intel/facility-images/ChIJ6dRGcsYraYgRyaqUTCcaufI.jpg,2026-03-30T16:04:45.626513
ChIJESPqWohYaYgRgc8xd8XXcEk,Mount Motors Inc,"1954 S Old 60, Salem, IN 47167, USA",38.549423999999995,-86.03864279999999,28.0,0.5,1,0,0,0,5,6,False,True,False,other,The facility appears to be a small property with a single building. There is fencing along the road. No trucks or trailers are visible in the lot.,/Users/justinfagan/dev/reseller-intel/facility-images/ChIJESPqWohYaYgRgc8xd8XXcEk.jpg,2026-03-30T16:04:48.737004
ChIJE-m2fN3BaYgRyCd8JJFjdE8,NAPA Auto Parts,"16 Village Plz, Shelbyville, KY 40065, USA",38.211447,-85.240881,28.2,4.0,1,1,0,0,5,4,False,False,True,parts_warehouse,"The facility appears to be a parts warehouse, likely a NAPA Auto Parts distribution center. The building's roof is in poor condition. The parking lot is large and organized, but there are no trucks or trailers visible.",/Users/justinfagan/dev/reseller-intel/facility-images/ChIJE-m2fN3BaYgRyCd8JJFjdE8.jpg,2026-03-30T16:04:51.952517
ChIJ8zfzALHnaIgRfncJsqEZ9Hs,Billy's Towing and Recovery,"1690 S Dixie Blvd, Radcliff, KY 40160, USA",37.819807,-85.92492469999999,28.3,1.5,3,0,0,0,5,6,False,False,False,storage_yard,The facility appears to be a storage yard with a couple of small buildings. There are no trucks or trailers visible in the lot. The lot appears somewhat unorganized and not very clean.,/Users/justinfagan/dev/reseller-intel/facility-images/ChIJ8zfzALHnaIgRfncJsqEZ9Hs.jpg,2026-03-30T16:04:55.233544
ChIJsxfdwCXga4gRGjWIg6Fsd94,Central Truck & Trailer Repair,"1014 S Franklin School Rd, Salem, IN 47167, USA",38.5898457,-85.9593826,28.5,2.5,4,0,0,0,3,4,False,False,False,repair_shop,"The facility appears to be a small repair shop with multiple buildings in varying conditions. The lot is cluttered with equipment and vehicles, suggesting a lack of organization. No signage is visible from the satellite imagery.",/Users/justinfagan/dev/reseller-intel/facility-images/ChIJsxfdwCXga4gRGjWIg6Fsd94.jpg,2026-03-30T16:04:58.636967
ChIJ39KUBSzBaYgRLmMwLnkMgvU,Mosby’s Towing & Transport LLC,"202 Kentucky St, Shelbyville, KY 40065, USA",38.20532670000001,-85.2249719,29.0,1.5,3,2,0,0,6,6,False,False,True,service_center,"This facility appears to be a service center with a few buildings and a parking lot. The lot is organized, but there are no trucks or trailers visible in the lot. The building condition is average.",/Users/justinfagan/dev/reseller-intel/facility-images/ChIJ39KUBSzBaYgRLmMwLnkMgvU.jpg,2026-03-30T16:05:01.964351
ChIJOQTewpGMaYgRb7SArI67T1Y,Boss Truck Shop,"203 Pendleton Rd, Pendleton, KY 40055, USA",38.453679,-85.2977094,30.2,4.5,1,6,5,30,6,7,False,False,True,service_center,"The facility appears to be a truck service center with a moderate number of service bays. There are many trailers parked on the lot, suggesting storage or staging. The lot appears relatively organized, but there is no visible signage or fencing.",/Users/justinfagan/dev/reseller-intel/facility-images/ChIJOQTewpGMaYgRb7SArI67T1Y.jpg,2026-03-30T16:05:06.269908
ChIJ5a_Ob6CNaYgRlxM1wR8W_lg,Speedco Truck Lube and Tires,"524 Pendleton Rd, Pendleton, KY 40055, USA",38.4597859,-85.2986756,30.4,2.5,3,6,2,2,7,8,False,False,True,service_center,"This appears to be a well-maintained truck service center. The lot is mostly organized, and the building looks to be in good condition. There are several service bays visible, and a few trucks and trailers are parked on the property.",/Users/justinfagan/dev/reseller-intel/facility-images/ChIJ5a_Ob6CNaYgRlxM1wR8W_lg.jpg,2026-03-30T16:05:09.603798
ChIJCfqr7xzba4gREAk2ouJjn28,"TC Auto and Performance, INC","3033 S U.S. Hwy 31, Scottsburg, IN 47170, USA",38.6481715,-85.7743979,30.4,2.5,4,0,0,0,6,7,False,False,True,dealer,The facility appears to be a car dealership with multiple buildings. The lot is mostly organized with vehicles parked in rows. There is no visible signage or fencing.,/Users/justinfagan/dev/reseller-intel/facility-images/ChIJCfqr7xzba4gREAk2ouJjn28.jpg,2026-03-30T16:05:12.904994
ChIJefGSvHD9a4gRp6bKSDs4-eI,John Jones Commercial & Fleet Sales Salem,"1450 IN-60, Salem, IN 47167, USA",38.581286,-86.0586087,30.4,4.5,1,0,0,0,8,8,False,False,True,dealer,"The facility appears to be a car dealership with a large building and organized parking. There are no visible trucks or trailers, and no service bays are apparent from the satellite view. The lot appears clean and well-maintained.",/Users/justinfagan/dev/reseller-intel/facility-images/ChIJefGSvHD9a4gRp6bKSDs4-eI.jpg,2026-03-30T16:05:16.452239
ChIJISyKtfzZa4gRb9-xvfQQY5k,Double A Fleet Service LLC,"219 IN-356, Scottsburg, IN 47170, USA",38.6495646,-85.77067869999999,30.5,1.5,4,6,2,10,5,6,False,False,False,repair_shop,The facility appears to be a truck repair shop with several service bays. There are a few trucks and several trailers parked on the lot. The lot appears somewhat disorganized and there is no visible fencing.,/Users/justinfagan/dev/reseller-intel/facility-images/ChIJISyKtfzZa4gRb9-xvfQQY5k.jpg,2026-03-30T16:05:19.829685
ChIJvfGYFD_Xa4gRUoL7QjR1-TY,"Parris Auto, Truck, & RV Repair Services LLC","219 IN-356 Suite 4, Scottsburg, IN 47170, USA",38.6494241,-85.7707896,30.5,1.5,4,6,0,2,5,6,False,False,False,repair_shop,"The facility appears to be a repair shop with multiple service bays. The lot is somewhat cluttered with vehicles and equipment. The building condition is fair, but no signage is visible.",/Users/justinfagan/dev/reseller-intel/facility-images/ChIJvfGYFD_Xa4gRUoL7QjR1-TY.jpg,2026-03-30T16:05:23.214272
ChIJ9U3OYThSaIgRw0VbVRIBiDg,44 Auto Mart Bardstown,"104 W John Rowan Blvd, Bardstown, KY 40004, USA",37.826954199999996,-85.4647279,30.9,1.5,2,0,0,0,7,7,False,False,True,dealer,This facility appears to be a car dealership with two main buildings. The lot is well-organized with rows of vehicles for sale. No trucks or trailers are visible in the lot.,/Users/justinfagan/dev/reseller-intel/facility-images/ChIJ9U3OYThSaIgRw0VbVRIBiDg.jpg,2026-03-30T16:05:26.687591
ChIJQ1XlAMDnaIgRfUOdlt6VU90,Kentucky Jeep and Truck,"5796 N Dixie Hwy, Elizabethtown, KY 42701, USA",37.7691535,-85.9025192,31.3,2.5,4,0,0,0,6,6,False,False,True,dealer,"The facility appears to be a car dealership with multiple buildings. The lot is somewhat organized, but there is no visible signage or fencing. The building conditions are average.",/Users/justinfagan/dev/reseller-intel/facility-images/ChIJQ1XlAMDnaIgRfUOdlt6VU90.jpg,2026-03-30T16:05:29.796690
ChIJ1dVz9rnnaIgRKEC1VWw_GRo,Car-Mart of Elizabethtown,"5730 N Dixie Hwy, Elizabethtown, KY 42701, USA",37.7681508,-85.9020001,31.4,1.5,2,0,0,0,7,7,True,False,True,dealer,"This appears to be a car dealership. The lot is fairly organized with cars parked in rows. There are two buildings on the property, one larger than the other.",/Users/justinfagan/dev/reseller-intel/facility-images/ChIJ1dVz9rnnaIgRKEC1VWw_GRo.jpg,2026-03-30T16:05:32.934750
ChIJ-VIr7aVNaIgRCbtj2I_SBa4,Ellis Towing LLC,"515 Old Bloomfield Rd, Bardstown, KY 40004, USA",37.8401505,-85.4073636,31.9,0.75,2,3,0,1,5,6,False,False,False,service_center,"The facility appears to be a small service center or repair shop. There are two buildings, one of which has multiple service bays. The lot appears somewhat disorganized with equipment and vehicles scattered around.",/Users/justinfagan/dev/reseller-intel/facility-images/ChIJ-VIr7aVNaIgRCbtj2I_SBa4.jpg,2026-03-30T16:05:36.080140
ChIJEYZGT_3ja4gRFCg8SrJQxwA,Salem Fleet Service,"1313 S Jackson St, Salem, IN 47167, USA",38.5969617,-86.08217979999999,32.0,4.5,5,15,12,10,5,6,False,False,False,service_center,"This facility appears to be a commercial truck service center. There are multiple buildings with service bays, and a number of trucks and trailers parked on the lot. The lot appears somewhat disorganized and lacks fencing.",/Users/justinfagan/dev/reseller-intel/facility-images/ChIJEYZGT_3ja4gRFCg8SrJQxwA.jpg,2026-03-30T16:05:40.080962
ChIJH5EJHKjJbogRJLCTjjDXRBo,Speedco Truck Lube and Tires,"6582 IN-66, Leavenworth, IN 47137, USA",38.244446499999995,-86.3563247,32.5,6.5,1,6,15,30,7,8,False,False,True,service_center,"This appears to be a well-maintained truck service center with ample parking for trucks and trailers. The lot is organized, and the building appears to be in good condition. There is no visible fencing or signage.",/Users/justinfagan/dev/reseller-intel/facility-images/ChIJH5EJHKjJbogRJLCTjjDXRBo.jpg,2026-03-30T16:05:43.205947
ChIJ-yo1qZfJbogRqq2-2ElsVfo,Love's Travel Stop,"6582 IN-66, Leavenworth, IN 47137, USA",38.2445455,-86.35736539999999,32.6,7.5,3,12,15,10,7,7,True,False,True,service_center,"This Love's Travel Stop appears to be well-maintained with organized parking. There are multiple service bays and a good number of trucks and trailers present. The facility includes a main building, a smaller building, and a covered area with bays.",/Users/justinfagan/dev/reseller-intel/facility-images/ChIJ-yo1qZfJbogRqq2-2ElsVfo.jpg,2026-03-30T16:05:47.221750
ChIJSZONcFr9a4gRuPwOH0Czdmc,"Wilcox Towing & Trucking, Inc","202 W Joseph St, Salem, IN 47167, USA",38.5953425,-86.10346129999999,32.6,2.5,3,4,2,3,3,5,False,False,False,storage_yard,"The facility appears to be primarily a storage yard with a large number of vehicles. The lot is not well-organized and appears somewhat cluttered. Building conditions are average, and there is no visible signage or fencing.",/Users/justinfagan/dev/reseller-intel/facility-images/ChIJSZONcFr9a4gRuPwOH0Czdmc.jpg,2026-03-30T16:05:50.285968
ChIJFzt8or_JbogRwjeV9jmlMjQ,"Weaver Brothers, LLC","6948 S IN-66, Leavenworth, IN 47137, USA",38.237894,-86.360081,32.7,5.5,3,6,12,15,5,6,False,False,False,storage_yard,"This facility appears to be a storage yard for trucks and trailers. The lot is not very organized, and the cleanliness score is moderate. There are multiple buildings, including one large warehouse-style building with several bays.",/Users/justinfagan/dev/reseller-intel/facility-images/ChIJFzt8or_JbogRwjeV9jmlMjQ.jpg,2026-03-30T16:05:53.564846
ChIJ6bMR26vvaYgRpPYQ0rUzisU,Bohannon Diesel & Transmission Repair,"6589 Main St, Eminence, KY 40019, USA",38.353958999999996,-85.1849537,32.7,1.5,3,6,0,0,5,6,False,False,False,repair_shop,The facility appears to be a diesel and transmission repair shop with two main buildings and a silo. The lot is somewhat cluttered with vehicles and equipment. There is no visible signage or fencing.,/Users/justinfagan/dev/reseller-intel/facility-images/ChIJ6bMR26vvaYgRpPYQ0rUzisU.jpg,2026-03-30T16:05:56.789306
ChIJFzt8or_JbogRABcyEdPTZf4,Right Way Diesel Service,"6948 S IN-66, Carefree, IN 47137, USA",38.237889,-86.36002400000001,32.7,6.5,2,6,12,10,5,6,False,False,False,repair_shop,This facility appears to be a truck repair shop with a large lot for parking and storage. The lot is not very organized and there are several trucks and trailers visible. The building condition is average.,/Users/justinfagan/dev/reseller-intel/facility-images/ChIJFzt8or_JbogRABcyEdPTZf4.jpg,2026-03-30T16:06:00.160904
ChIJOZr9hGHaa4gRLQpdPCx5VBY,John Jones Auto Group - Scottsburg Service & Parts,"1351 IN-56, Scottsburg, IN 47170, USA",38.684004099999996,-85.80074660000001,32.9,3.0,1,0,0,0,8,8,True,False,True,dealer,The facility appears to be a car dealership with a large building and organized parking. There are no trucks or trailers visible in the lot. The building and lot appear to be well-maintained.,/Users/justinfagan/dev/reseller-intel/facility-images/ChIJOZr9hGHaa4gRLQpdPCx5VBY.jpg,2026-03-30T16:06:03.440455
ChIJRcjSVADvaIgRjgm1MQ6SOOA,All Around Auto Care,"4740 Bardstown Rd, Elizabethtown, KY 42701, USA",37.732800499999996,-85.79033969999999,32.9,4.5,3,6,0,50,6,7,False,True,True,storage_yard,The facility appears to be primarily a trailer storage yard with a couple of buildings that may be used for office or light repair. The lot is fenced and the trailers are parked in an organized manner. There is no visible signage from the satellite imagery.,/Users/justinfagan/dev/reseller-intel/facility-images/ChIJRcjSVADvaIgRjgm1MQ6SOOA.jpg,2026-03-30T16:06:06.494989
ChIJsTrAz0faa4gRY6mMuRswMkU,Big O Tires Scottsburg - McClain Ave,"1621 W McClain Ave, Scottsburg, IN 47170, USA",38.6844671,-85.79674779999999,33.0,1.5,4,6,0,0,6,6,False,False,True,service_center,"This facility appears to be a service center with multiple buildings. There are several service bays visible on one of the buildings. The lot is somewhat organized, but the building conditions appear to be average.",/Users/justinfagan/dev/reseller-intel/facility-images/ChIJsTrAz0faa4gRY6mMuRswMkU.jpg,2026-03-30T16:06:09.893032
ChIJ7ThIdWvja4gRBERm5NbKIJc,5 Star Diesel Performance,"2706 N Old 56, Salem, IN 47167, USA",38.6432006,-86.0164726,33.1,2.5,2,6,0,0,6,7,False,True,True,repair_shop,"This facility appears to be a truck repair shop with a fenced lot. There are two buildings, one of which has multiple service bays. The lot is organized, but there are no trucks or trailers visible in the lot at the time of the satellite image.",/Users/justinfagan/dev/reseller-intel/facility-images/ChIJ7ThIdWvja4gRBERm5NbKIJc.jpg,2026-03-30T16:06:14.010033
ChIJzU1mk0j9a4gRFJ457G54kmo,NAPA Auto Parts,"200 W Market St, Salem, IN 47167, USA",38.605452,-86.102227,33.1,0.8,2,0,0,0,5,6,False,False,False,parts_warehouse,"The facility appears to be a parts warehouse with a small building and a large, unorganized lot. There is no visible signage or fencing. The lot appears to be mostly empty.",/Users/justinfagan/dev/reseller-intel/facility-images/ChIJzU1mk0j9a4gRFJ457G54kmo.jpg,2026-03-30T16:06:17.052295
ChIJ-12kQMrRa4gRwMW_OOPmEyI,Bar J Truck Repair,"3322 IN-56, Scottsburg, IN 47170, USA",38.6856903,-85.7135713,33.1,2.5,3,6,2,0,5,6,False,False,False,repair_shop,"This facility appears to be a truck repair shop with multiple service bays. The lot is somewhat cluttered, and there is no visible signage or fencing. The building condition is average.",/Users/justinfagan/dev/reseller-intel/facility-images/ChIJ-12kQMrRa4gRwMW_OOPmEyI.jpg,2026-03-30T16:06:19.991467
ChIJOdGPwsj9a4gR6z3b0NpXGg4,Midwest Tire & Service LLC,"906 E Hackberry St, Salem, IN 47167, USA",38.6110444,-86.0919203,33.1,0.7,2,2,0,0,6,6,False,False,False,repair_shop,The facility appears to be a small repair shop with two buildings. The lot is not very organized and there are no trucks or trailers visible. The building condition is average.,/Users/justinfagan/dev/reseller-intel/facility-images/ChIJOdGPwsj9a4gR6z3b0NpXGg4.jpg,2026-03-30T16:06:22.830644
ChIJxzZonTX9a4gRhGyOqB5oUkY,Salem Wrecker Service,"307 Locust St, Salem, IN 47167, USA",38.6085548,-86.0960922,33.1,0.7,5,2,0,0,5,6,False,False,False,repair_shop,The facility appears to be a small repair shop with multiple buildings. The lot is not particularly organized and there is no visible signage or fencing. There are no trucks or trailers visible in the lot.,/Users/justinfagan/dev/reseller-intel/facility-images/ChIJxzZonTX9a4gRhGyOqB5oUkY.jpg,2026-03-30T16:06:25.792716
ChIJk42sTrfja4gRVwabVQGYFp0,Washington Co Tire Shop,"101 E Progress Blvd, Salem, IN 47167, USA",38.6123001,-86.0868028,33.1,1.5,1,2,1,1,6,7,False,False,False,repair_shop,"The facility appears to be a tire repair shop with a single large building. There are a few trucks and trailers visible, and the lot is somewhat organized. The building appears to be in decent condition.",/Users/justinfagan/dev/reseller-intel/facility-images/ChIJk42sTrfja4gRVwabVQGYFp0.jpg,2026-03-30T16:06:29.337673
ChIJ32DBGs-5pwIRxaMAVShuONk,"A.T.R Truck,Trailer&Fleet","193 N Gardner St, Scottsburg, IN 47170, USA",38.6890752,-85.7784611,33.2,0.7,3,4,0,0,5,6,False,False,False,repair_shop,The facility appears to be a small repair shop with a few service bays. The lot is not very organized and there are no trucks or trailers visible. The building condition is average.,/Users/justinfagan/dev/reseller-intel/facility-images/ChIJ32DBGs-5pwIRxaMAVShuONk.jpg,2026-03-30T16:06:32.665410
ChIJrzDDFmh82kARXrqJRwgXdVY,On the Way Mobile Truck and Trailer Repair LLC,"711 Houston St, Salem, IN 47167, USA",38.6086459,-86.1003896,33.2,0.7,1,0,1,0,6,7,False,False,True,service_center,The facility appears to be a service center with a single building and a parking lot. There is one large truck visible. The lot appears to be somewhat organized.,/Users/justinfagan/dev/reseller-intel/facility-images/ChIJrzDDFmh82kARXrqJRwgXdVY.jpg,2026-03-30T16:06:35.670330
ChIJ6RSADG_aa4gRALOe3-fhR5M,NAPA Auto Parts - Scottsburg Auto Parts,"376 N Gardner St, Scottsburg, IN 47170, USA",38.690788999999995,-85.779759,33.3,1.2,3,0,0,0,7,7,True,False,True,parts_warehouse,"The facility appears to be a NAPA auto parts store with a main building and two smaller outbuildings. The parking lot is organized, and the buildings appear to be in decent condition. No trucks or trailers are visible in the lot.",/Users/justinfagan/dev/reseller-intel/facility-images/ChIJ6RSADG_aa4gRALOe3-fhR5M.jpg,2026-03-30T16:06:38.861279
ChIJlwoeFGTaa4gRA6fWY62aMsE,Goodin's Wrecker Services,"887 N Gardner St, Scottsburg, IN 47170, USA",38.6964073,-85.78151700000001,33.7,4.5,5,4,3,25,4,5,False,False,False,storage_yard,"This facility appears to be primarily a storage yard for trailers and other equipment. The lot is not very organized and the cleanliness score is low. There are multiple buildings on the property, including a main building with service bays.",/Users/justinfagan/dev/reseller-intel/facility-images/ChIJlwoeFGTaa4gRA6fWY62aMsE.jpg,2026-03-30T16:06:42.225156
ChIJyZ6ONNdNaIgRZG5bqosALXk,First Fleet,"1755 Parkway Dr, Bardstown, KY 40004, USA",37.808891200000005,-85.40586850000001,33.7,10.0,1,50,15,75,8,8,False,False,True,service_center,This appears to be a large distribution or service center. The lot is well-organized with many trailers and some trucks visible. The building appears to be in good condition.,/Users/justinfagan/dev/reseller-intel/facility-images/ChIJyZ6ONNdNaIgRZG5bqosALXk.jpg,2026-03-30T16:06:46.114897
