place_id,name,address,lat,lng,distance_miles,facility_size_acres,building_count,bay_count,trucks_visible,trailers_visible,cleanliness_score,building_condition,has_signage,has_fencing,lot_organized,facility_type,analysis_notes,image_path,analyzed_at
ChIJ-WJDhfMNaYgRHeoMYAZDyCw,FleetPride Service Center,"355 Farmington Ave, Louisville, KY 40209, USA",38.2001136,-85.7553746,0.6,4.5,1,10,10,25,6,7,False,False,True,service_center,"The facility appears to be a service center with a large parking area for trucks and trailers. The lot is relatively organized, and the building appears to be in decent condition. There is no visible signage or fencing.",/Users/justinfagan/dev/reseller-intel/facility-images/ChIJ-WJDhfMNaYgRHeoMYAZDyCw.jpg,2026-03-30T15:49:39.178748
ChIJzbLCjSUNaYgR07uB9vzkYqk,Sternberg Commercial Truck Sales,"3700 Crittenden Dr, Louisville, KY 40209, USA",38.1993662,-85.75142679999999,0.8,4.5,2,10,15,5,7,7,False,False,True,dealer,"This facility appears to be a commercial truck dealership. The lot is well-organized with many trucks and vans parked in rows. There are several service bays visible, suggesting repair services are offered.",/Users/justinfagan/dev/reseller-intel/facility-images/ChIJzbLCjSUNaYgR07uB9vzkYqk.jpg,2026-03-30T15:49:42.368898
ChIJcUkLdlQNaYgRQO4XhJXWRWg,SMM TRUCK REPAIR CORP,"720 Locust Ln, Louisville, KY 40217, USA",38.206399999999995,-85.7407454,1.0,3.5,1,10,15,30,5,6,False,True,True,repair_shop,"This facility appears to be a truck repair shop with a large storage yard for trailers. The lot is fenced, and parking is generally organized. The building appears to be in fair condition, but the overall cleanliness of the lot could be improved.",/Users/justinfagan/dev/reseller-intel/facility-images/ChIJcUkLdlQNaYgRQO4XhJXWRWg.jpg,2026-03-30T15:49:46.140472
ChIJGcjpQ2INaYgR-sqytGOsagk,AT Truck & Trailer Service LLC,"1815 Commerce Rd Suite 1, Louisville, KY 40208, USA",38.221243199999996,-85.7726472,1.1,4.5,6,0,0,1,4,5,False,False,False,storage_yard,The facility appears to be a storage yard with multiple large buildings. There is one trailer visible. The lot appears somewhat unorganized and the building conditions are average.,/Users/justinfagan/dev/reseller-intel/facility-images/ChIJGcjpQ2INaYgR-sqytGOsagk.jpg,2026-03-30T15:49:49.398364
ChIJ3yvNh54NaYgRFUMcpBFYlkE,Dexter's Auto & Truck Service,"518 Dakota St, Louisville, KY 40209, USA",38.1944914,-85.748924,1.1,2.5,6,10,2,0,5,5,False,False,False,repair_shop,"The facility appears to be a truck and auto repair shop with multiple buildings. The lot is somewhat cluttered, and the building conditions vary. There is no visible signage or fencing.",/Users/justinfagan/dev/reseller-intel/facility-images/ChIJ3yvNh54NaYgRFUMcpBFYlkE.jpg,2026-03-30T15:49:52.636901
ChIJwWmXXZkNaYgRmd3HM5YHduE,Goodyear Commercial Tire & Service Center,"4334 Crittenden Dr, Louisville, KY 40209, USA",38.1916942,-85.7520862,1.2,4.5,3,15,4,1,7,7,True,False,True,service_center,"The facility appears to be a Goodyear Commercial Tire & Service Center. There are multiple service bays visible, and the parking lot is well-organized. The facility seems to be in good condition overall.",/Users/justinfagan/dev/reseller-intel/facility-images/ChIJwWmXXZkNaYgRmd3HM5YHduE.jpg,2026-03-30T15:49:55.911224
ChIJCRZkvkQNaYgRaVoZV2EeNCY,Best-One Louisville,"1501 S Brook St, Louisville, KY 40208, USA",38.224888899999996,-85.7552943,1.2,2.5,4,10,3,3,6,6,False,False,True,service_center,"The facility appears to be a service center with multiple service bays. The lot is somewhat organized, but the building condition appears to be average. There is no visible signage or fencing.",/Users/justinfagan/dev/reseller-intel/facility-images/ChIJCRZkvkQNaYgRaVoZV2EeNCY.jpg,2026-03-30T15:49:59.161518
ChIJHynIw_MTaYgRi4_fFf5ZfUw,Tirexpress Truck,"2220 7th Street Rd, Louisville, KY 40208, USA",38.2182414,-85.78038269999999,1.3,3.5,3,24,0,4,7,7,False,False,True,service_center,"The facility appears to be a truck service center with multiple service bays. The lot is relatively organized, and the buildings appear to be in decent condition. There are a few trailers parked on the property, but no trucks are visible.",/Users/justinfagan/dev/reseller-intel/facility-images/ChIJHynIw_MTaYgRi4_fFf5ZfUw.jpg,2026-03-30T15:50:02.236649
ChIJDxPsCVcSaYgRksMxmyiyJz8,Shively Truck Service,"2756 7th Street Rd, Louisville, KY 40215, USA",38.2114597,-85.7873212,1.5,4.5,8,15,3,5,5,6,False,False,False,service_center,This facility appears to be a truck service center with multiple buildings and service bays. The lot is not very organized and there is no visible signage or fencing. The building conditions are average.,/Users/justinfagan/dev/reseller-intel/facility-images/ChIJDxPsCVcSaYgRksMxmyiyJz8.jpg,2026-03-30T15:50:05.540726
ChIJKV4ZzZISaYgRmgfTZuMu200,Truck Parts & Service Inc.,"2758 7th Street Rd, Louisville, KY 40215, USA",38.211231,-85.7866018,1.5,2.5,9,15,0,0,5,6,False,False,False,repair_shop,"The facility has multiple buildings, some with visible service bays. The lot appears somewhat cluttered and lacks organized parking. No trucks or trailers are visible in the lot, and there is no visible signage or fencing.",/Users/justinfagan/dev/reseller-intel/facility-images/ChIJKV4ZzZISaYgRmgfTZuMu200.jpg,2026-03-30T15:50:08.917542
ChIJzyXfoj8OaYgRoSZsNfM26vM,Autocar Parts LLC,"1458 S Shelby St, Louisville, KY 40217, USA",38.2259616,-85.7425538,1.5,3.5,2,6,1,3,7,7,False,False,True,parts_warehouse,The facility appears to be a parts warehouse with a decent sized lot. The parking lot is organized and there are a few trailers parked. The building condition is average and there is no visible signage.,/Users/justinfagan/dev/reseller-intel/facility-images/ChIJzyXfoj8OaYgRoSZsNfM26vM.jpg,2026-03-30T15:50:12.721350
ChIJdb6N3PwPaYgRSjJjoNu8Zes,JIT Truck Parts,"1458 S Shelby St, Louisville, KY 40217, USA",38.2259616,-85.7425538,1.5,3.5,2,6,1,2,7,7,False,False,True,parts_warehouse,"The facility appears to be a parts warehouse with a decent sized lot. The lot is organized with designated parking spaces. There are a few loading docks visible, suggesting active shipping and receiving operations.",/Users/justinfagan/dev/reseller-intel/facility-images/ChIJdb6N3PwPaYgRSjJjoNu8Zes.jpg,2026-03-30T15:50:15.943674
ChIJk9NP25ISaYgR70ZU2b1CX1E,Tip Top Mobile Detail & Wash,"2752 7th Street Rd Unit#3, Louisville, KY 40215, USA",38.2117722,-85.7867522,1.5,4.5,8,15,0,0,5,6,False,False,False,service_center,"The facility appears to be a commercial service center with multiple buildings and service bays. There is a large area with many cars, possibly for parts or repair. The lot appears somewhat disorganized and could use some cleaning.",/Users/justinfagan/dev/reseller-intel/facility-images/ChIJk9NP25ISaYgR70ZU2b1CX1E.jpg,2026-03-30T15:50:19.347133
ChIJdd9qO8sNaYgRfV9mBgbhhXY,Louisville Roadside & Towing,"1340 S 3rd St, Louisville, KY 40208, USA",38.2311127,-85.75989560000001,1.6,0.2,5,0,0,0,7,7,False,False,False,other,"The facility appears to be a residential area with multiple buildings. There are no visible trucks or trailers, and no signs of a commercial truck facility. The buildings appear to be in decent condition.",/Users/justinfagan/dev/reseller-intel/facility-images/ChIJdd9qO8sNaYgRfV9mBgbhhXY.jpg,2026-03-30T15:50:22.618532
ChIJzc8DqHUNaYgR4zg2kDJkvl8,Peak Trailer Repair Services,"4601 Allmond Ave Suite 200, Louisville, KY 40209, USA",38.1836863,-85.757454,1.7,3.5,1,12,2,12,7,8,False,False,True,repair_shop,The facility appears to be a truck repair shop with a large building and several service bays. There are a number of trailers parked in an organized manner. The building appears to be in good condition.,/Users/justinfagan/dev/reseller-intel/facility-images/ChIJzc8DqHUNaYgR4zg2kDJkvl8.jpg,2026-03-30T15:50:25.826539
ChIJI4mpw40NaYgRJpxHsiviH4M,Wiers Fleet Service & Truck Repair Louisville,"4621 Allmond Ave, Louisville, KY 40209, USA",38.1812956,-85.7580864,1.9,4.5,3,10,12,25,6,6,False,False,True,repair_shop,"This facility appears to be a truck repair shop with a decent amount of truck and trailer parking. The lot is somewhat organized, but the building condition appears to be average. There is no visible signage or fencing.",/Users/justinfagan/dev/reseller-intel/facility-images/ChIJI4mpw40NaYgRJpxHsiviH4M.jpg,2026-03-30T15:50:28.990056
ChIJhd0jUuMTaYgRMKYd7uqcXxg,Reliable Truck Service,"3433 S 7th St, Louisville, KY 40216, USA",38.2007036,-85.7934451,1.9,4.5,2,6,10,35,5,6,False,True,True,service_center,"This facility appears to be a truck service center with a large number of trailers stored on site. The lot is mostly organized, and there is fencing around the perimeter. The building condition is average, and there is no visible signage.",/Users/justinfagan/dev/reseller-intel/facility-images/ChIJhd0jUuMTaYgRMKYd7uqcXxg.jpg,2026-03-30T15:50:32.468423
ChIJaaf6tYoNaYgRFIBn5OOZq7A,502 HP Diesel,"121 Badger Ave, Louisville, KY 40214, USA",38.1803752,-85.761354,1.9,4.5,5,10,0,15,4,5,False,False,False,storage_yard,"The facility appears to be a storage yard with multiple buildings. There are many trailers and vehicles parked on the lot, but no visible trucks. The lot appears somewhat disorganized and the building conditions are average.",/Users/justinfagan/dev/reseller-intel/facility-images/ChIJaaf6tYoNaYgRFIBn5OOZq7A.jpg,2026-03-30T15:50:35.518811
ChIJZT2hnl0NaYgRnj98ukC4R_g,Gabriel and Sons Welded Fortress LLC,"134 E Woodlawn Ave, Louisville, KY 40214, USA",38.18089270000001,-85.7608595,1.9,2.5,5,10,0,0,4,5,False,False,False,repair_shop,The facility appears to be a repair shop with multiple buildings and service bays. The lot is not very organized and the building conditions are average. There is no visible signage or fencing.,/Users/justinfagan/dev/reseller-intel/facility-images/ChIJZT2hnl0NaYgRnj98ukC4R_g.jpg,2026-03-30T15:50:38.621443
ChIJjS5eIcANaYgRXz-2XIYMN7w,Cardinal Parts | Auto & Truck,"4710 Allmond Ave, Louisville, KY 40209, USA",38.1791836,-85.7589156,2.0,2.5,3,0,0,0,7,6,False,False,True,parts_warehouse,"The facility appears to be a parts warehouse with multiple buildings. The parking lot is organized, and the overall cleanliness is decent. There is no visible signage or fencing.",/Users/justinfagan/dev/reseller-intel/facility-images/ChIJjS5eIcANaYgRXz-2XIYMN7w.jpg,2026-03-30T15:50:41.782613
ChIJtxBfsaQNaYgRn8bhUYkVdx4,Diesel Advantage,"4710 Allmond Ave, Louisville, KY 40209, USA",38.1791835,-85.7589158,2.0,1.5,2,0,0,0,7,6,False,False,True,other,"The facility appears to be an industrial building with a parking lot. There are no trucks or trailers visible, and the building condition is fair. It is difficult to determine the exact use of the facility from the satellite imagery.",/Users/justinfagan/dev/reseller-intel/facility-images/ChIJtxBfsaQNaYgRn8bhUYkVdx4.jpg,2026-03-30T15:50:45.823170
ChIJ51MGBo0NaYgRdjFkmQ29c8Y,"Diesel USA Group, Inc.","4710 Allmond Ave, Louisville, KY 40209, USA",38.1791267,-85.7590669,2.0,3.5,3,10,0,0,7,7,False,False,True,service_center,"The facility consists of three large buildings with a paved parking lot. There are several service bays visible, suggesting a service or repair focus. The lot appears organized, but there are no trucks or trailers visible in the lot.",/Users/justinfagan/dev/reseller-intel/facility-images/ChIJ51MGBo0NaYgRdjFkmQ29c8Y.jpg,2026-03-30T15:50:49.043742
ChIJicUHINoNaYgR0m5YQhufmsY,Grizzly,"4710 Allmond Ave, Louisville, KY 40209, USA",38.179183699999996,-85.7589157,2.0,2.5,1,0,0,0,7,6,False,False,True,other,"The facility appears to be a warehouse or distribution center. The parking lot is organized, and the building appears to be in fair condition. There are no trucks or trailers visible in the lot.",/Users/justinfagan/dev/reseller-intel/facility-images/ChIJicUHINoNaYgR0m5YQhufmsY.jpg,2026-03-30T15:50:52.328979
ChIJO-SqC40NaYgR_9EAw6U54tk,Tredroc Tire Co,"4703 Allmond Ave, Louisville, KY 40209, USA",38.178966200000005,-85.7579413,2.0,3.5,2,10,0,0,7,7,False,False,True,parts_warehouse,"The facility appears to be a parts warehouse with two large buildings. There are several loading docks visible, and a large number of tires are stored outside. The lot appears organized, but there is no visible signage or fencing.",/Users/justinfagan/dev/reseller-intel/facility-images/ChIJO-SqC40NaYgR_9EAw6U54tk.jpg,2026-03-30T15:50:55.937089
ChIJuxcagO8SaYgRkJS-c87yQpM,AA TRUCK TIRE SERVICES,"2606 Dixie Hwy, Shively, KY 40216, USA",38.2125408,-85.79745419999999,2.1,0.7,2,0,0,0,4,5,False,False,False,other,The facility appears to be a small lot with a building and some storage. The lot is not very organized and there is no visible signage. The building condition appears to be fair.,/Users/justinfagan/dev/reseller-intel/facility-images/ChIJuxcagO8SaYgRkJS-c87yQpM.jpg,2026-03-30T15:50:59.470777
ChIJKY8g0boNaYgRzIZVF9UN6HA,Bob Sumerel Tire Co.,"4850 Crittenden Dr bldg 1, Louisville, KY 40209, USA",38.177321400000004,-85.7507442,2.2,4.5,4,10,3,4,7,7,False,False,True,parts_warehouse,"This facility appears to be a parts warehouse with multiple buildings. The lot is relatively organized with designated parking spaces. There are a few trucks and trailers visible, suggesting regular shipping and receiving activity.",/Users/justinfagan/dev/reseller-intel/facility-images/ChIJKY8g0boNaYgRzIZVF9UN6HA.jpg,2026-03-30T15:51:02.631349
ChIJZQJCjPkSaYgReeMOkeTmAjg,Mosbys Towing & Transport LLC,"3119 Dixie Hwy, Louisville, KY 40216, USA",38.204316999999996,-85.7989149,2.2,3.5,4,6,5,10,5,6,False,False,False,storage_yard,"This facility appears to be a storage yard for trucks, trailers, and other vehicles. The lot is not very organized and there is no visible fencing or signage. The building condition is average.",/Users/justinfagan/dev/reseller-intel/facility-images/ChIJZQJCjPkSaYgReeMOkeTmAjg.jpg,2026-03-30T15:51:05.906763
ChIJLzhEvrRyaYgRm5nxIXdtpuc,A Mike's Tire & Trailer Repair,"301 E Breckinridge St, Louisville, KY 40203, USA",38.2411235,-85.75016579999999,2.3,1.2,4,6,2,3,5,5,False,False,True,repair_shop,"The facility appears to be a truck and trailer repair shop. There are several service bays visible. The lot is somewhat organized, but the building condition is average.",/Users/justinfagan/dev/reseller-intel/facility-images/ChIJLzhEvrRyaYgRm5nxIXdtpuc.jpg,2026-03-30T15:51:09.034061
ChIJGYpqSOsNaYgR18t9ESiig-s,"Vander Haag's, Inc.","405 MacLean Ave suite 5d, Louisville, KY 40209, USA",38.176051099999995,-85.7501115,2.3,3.5,2,6,5,3,7,6,False,False,True,parts_warehouse,"The facility appears to be a parts warehouse with some truck and trailer parking. The lot is relatively organized. The building condition is average, with some visible wear on the roof.",/Users/justinfagan/dev/reseller-intel/facility-images/ChIJGYpqSOsNaYgR18t9ESiig-s.jpg,2026-03-30T15:51:12.462104
ChIJq4huW7RyaYgRuiAdZFWZOT4,Republic Diesel Inc,"305 E College St, Louisville, KY 40203, USA",38.2430431,-85.74958160000001,2.4,2.5,3,8,0,0,5,6,False,False,False,repair_shop,The facility appears to be a truck repair shop with multiple service bays. The lot is somewhat cluttered with materials and the building condition is average. There is no visible signage or fencing.,/Users/justinfagan/dev/reseller-intel/facility-images/ChIJq4huW7RyaYgRuiAdZFWZOT4.jpg,2026-03-30T15:51:15.580940
ChIJAUUTWuISaYgRlxKXzKftXGo,Soran's Truck Repair Inc.,"3821 Fitzgerald Rd, Louisville, KY 40216, USA",38.213448799999995,-85.80653939999999,2.6,2.5,3,6,5,10,5,6,False,False,False,repair_shop,The facility appears to be a truck repair shop with a moderate amount of truck and trailer parking. The lot is not very organized and there is no visible fencing. The building condition is average.,/Users/justinfagan/dev/reseller-intel/facility-images/ChIJAUUTWuISaYgRlxKXzKftXGo.jpg,2026-03-30T15:51:19.359938
ChIJ4_3DhB0TaYgRnJu4IG9NADY,"Pendleton Trailer Services, Inc","3820 Fitzgerald Rd, Louisville, KY 40216, USA",38.213583799999995,-85.807142,2.6,2.5,5,10,0,20,6,6,False,False,True,storage_yard,"This facility appears to be primarily a trailer storage yard. There are several buildings, some of which have service bays. The lot appears somewhat organized, but not pristine. No trucks are visible, but many trailers are present.",/Users/justinfagan/dev/reseller-intel/facility-images/ChIJ4_3DhB0TaYgRnJu4IG9NADY.jpg,2026-03-30T15:51:22.432344
ChIJVVVVVVkLaYgRfXkcyuXZNxU,SHOATS TIRES,"2323 Ralph Ave, Louisville, KY 40216, USA",38.2069586,-85.8072275,2.6,3.5,3,10,15,20,5,6,False,False,False,service_center,This facility appears to be a truck service center with a large lot for parking trucks and trailers. The lot is not very organized and the building condition is average. There is no visible signage or fencing.,/Users/justinfagan/dev/reseller-intel/facility-images/ChIJVVVVVVkLaYgRfXkcyuXZNxU.jpg,2026-03-30T15:51:25.631639
ChIJ-VXXaLkTaYgRkBrZB3o-f8k,Depot Connect International (PSC),"3837 Fitzgerald Rd, Louisville, KY 40216, USA",38.2123894,-85.8066094,2.6,2.5,4,0,0,6,6,6,False,False,False,storage_yard,The facility appears to be primarily a storage yard for trailers and some equipment. The lot is not very organized and the building conditions are average. There is no visible signage or fencing.,/Users/justinfagan/dev/reseller-intel/facility-images/ChIJ-VXXaLkTaYgRkBrZB3o-f8k.jpg,2026-03-30T15:51:28.895926
ChIJz21YkTvs_SgR2JnN_xaweS8,Leo's Towing & Recovery,"715 S Jackson St, Louisville, KY 40203, USA",38.244223999999996,-85.745479,2.6,0.7,2,3,0,0,5,6,False,True,False,service_center,"The facility appears to be a towing and recovery service center. There are two buildings on the property, one of which has service bays. The lot appears somewhat cluttered with various vehicles and equipment.",/Users/justinfagan/dev/reseller-intel/facility-images/ChIJz21YkTvs_SgR2JnN_xaweS8.jpg,2026-03-30T15:51:31.842789
ChIJxyyc1spzaYgRKPloeD03Zdk,Louisville Truck and Auto Sales,"535 E Broadway, Louisville, KY 40202, USA",38.2453374,-85.7437858,2.7,1.2,5,10,15,0,6,6,False,False,True,dealer,"The facility appears to be a used truck dealership. There are several trucks parked on the lot. The lot appears somewhat organized, but not pristine. There is no visible signage or fencing.",/Users/justinfagan/dev/reseller-intel/facility-images/ChIJxyyc1spzaYgRKPloeD03Zdk.jpg,2026-03-30T15:51:35.742997
ChIJ-ZllU8lyaYgRnL6waYmHTHo,Meineke Car Care Center,"701 E Broadway, Louisville, KY 40202, USA",38.245221,-85.74113299999999,2.7,0.6,1,4,0,0,6,6,False,False,True,service_center,"The facility appears to be a Meineke Car Care Center. There are several service bays visible. The lot is relatively organized, but the building condition appears to be average.",/Users/justinfagan/dev/reseller-intel/facility-images/ChIJ-ZllU8lyaYgRnL6waYmHTHo.jpg,2026-03-30T15:51:39.172603
ChIJNUqmFM5yaYgRI4LbAsHjTtQ,Medley's Auto Truck Repair & Service,"633 S Campbell St, Louisville, KY 40204, USA",38.245351299999996,-85.7371833,2.8,1.2,3,6,0,0,6,6,False,False,True,repair_shop,"The facility appears to be a truck repair shop with multiple service bays. The lot is relatively organized, but the building condition is average. There is no visible signage or fencing.",/Users/justinfagan/dev/reseller-intel/facility-images/ChIJNUqmFM5yaYgRI4LbAsHjTtQ.jpg,2026-03-30T15:51:42.544519
ChIJUVt9Ru4NaYgRPMQfp12S8Wc,Global Parts - Traction,"4343 Sanita Ct, Louisville, KY 40213, USA",38.191833800000005,-85.712105,2.8,5.5,3,15,0,75,6,7,False,False,True,parts_warehouse,"This facility appears to be a parts warehouse, primarily storing trailers. The lot is fairly organized with rows of trailers. There is no visible signage or security fencing.",/Users/justinfagan/dev/reseller-intel/facility-images/ChIJUVt9Ru4NaYgRPMQfp12S8Wc.jpg,2026-03-30T15:51:45.828855
ChIJ6U1AN1kMaYgRhkBnMPtY1Sg,SelecTrucks of Louisville,"4341 Sanita Ct, Louisville, KY 40213, USA",38.192672699999996,-85.7110076,2.8,3.5,2,8,15,12,7,7,False,False,True,dealer,"This facility appears to be a commercial truck dealership. The lot is mostly organized with trucks and trailers parked in rows. There are two buildings, one with multiple service bays, suggesting repair services are offered.",/Users/justinfagan/dev/reseller-intel/facility-images/ChIJ6U1AN1kMaYgRhkBnMPtY1Sg.jpg,2026-03-30T15:51:49.065827
ChIJW1eE314MaYgRGTpv2TP7e8I,Ascendance Truck Centers,"4300 Poplar Level Rd, Louisville, KY 40213, USA",38.193675899999995,-85.7089233,2.9,4.5,1,15,10,8,7,7,False,False,True,service_center,"The facility appears to be a truck service center with a large building and multiple service bays. The lot is relatively organized with designated parking areas for trucks, trailers, and cars. There is no visible signage or fencing.",/Users/justinfagan/dev/reseller-intel/facility-images/ChIJW1eE314MaYgRGTpv2TP7e8I.jpg,2026-03-30T15:51:53.881927
ChIJJdmdPY4TaYgRMTK8LwLLc0U,Lua Truck Solution,"3030 Millers Ln, Louisville, KY 40216, USA",38.213409600000006,-85.814903,3.0,3.5,3,6,2,10,5,6,False,False,False,storage_yard,The facility appears to be a storage yard with several trailers and trucks parked on the lot. The lot is not very organized and there is no visible signage or fencing. The buildings appear to be in fair condition.,/Users/justinfagan/dev/reseller-intel/facility-images/ChIJJdmdPY4TaYgRMTK8LwLLc0U.jpg,2026-03-30T15:51:57.469232
ChIJjQpHyNVyaYgReEr_nitFXcQ,Smith Imported Car Service,"1250 E Broadway, Louisville, KY 40204, USA",38.2430904,-85.7274265,3.0,1.5,3,0,0,0,6,6,False,False,True,other,"The facility appears to have multiple buildings and a parking lot. There are no trucks or trailers visible. The lot seems relatively organized, but the building condition is average.",/Users/justinfagan/dev/reseller-intel/facility-images/ChIJjQpHyNVyaYgReEr_nitFXcQ.jpg,2026-03-30T15:52:00.776567
ChIJ15mkX14MaYgRc1CqODB4oLs,Kenworth of Louisville | Palmer Trucks,"4330 Poplar Level Rd, Louisville, KY 40213, USA",38.1925331,-85.7072219,3.0,4.5,2,15,20,5,7,7,True,False,True,dealer,"This facility appears to be a Kenworth dealership with a service center. The lot is mostly organized with designated parking. There are a number of trucks and trailers on the lot, indicating active sales and service operations.",/Users/justinfagan/dev/reseller-intel/facility-images/ChIJ15mkX14MaYgRc1CqODB4oLs.jpg,2026-03-30T15:52:04.322479
ChIJlWcYS9kNaYgRGv3bb-jBuK4,"Elite R Fleet & Equipment Repair, LLC","1821 Taylor Ave, Louisville, KY 40213, USA",38.2011907,-85.70340949999999,3.1,3.5,3,5,10,15,4,6,False,False,False,repair_shop,The facility appears to be a truck and equipment repair shop with a large number of trucks and trailers parked on the lot. The lot appears somewhat disorganized and cluttered. There is no visible signage or fencing.,/Users/justinfagan/dev/reseller-intel/facility-images/ChIJlWcYS9kNaYgRGv3bb-jBuK4.jpg,2026-03-30T15:52:07.613405
ChIJNYgAC1ptaYgRSN1-f7MrhqE,Lasco Truck Parts,"530 S 13th St, Louisville, KY 40203, USA",38.25133890000001,-85.7731781,3.1,3.5,2,10,3,0,6,7,False,False,True,parts_warehouse,"The facility consists of two large warehouse buildings with multiple bays, suggesting a parts warehouse or distribution center. The parking lot appears organized, and the buildings are in decent condition. No visible signage or security fencing is present.",/Users/justinfagan/dev/reseller-intel/facility-images/ChIJNYgAC1ptaYgRSN1-f7MrhqE.jpg,2026-03-30T15:52:11.057830
ChIJlzePdlptaYgRXx_z09VKE0Q,Louisville Auto Spring,"530 S 13th St, Louisville, KY 40203, USA",38.251373199999996,-85.77299490000001,3.1,2.5,2,15,5,3,6,7,False,False,True,repair_shop,"This facility appears to be a truck repair shop with multiple service bays. There are several trucks and trailers parked on the lot. The lot appears to be somewhat organized, but there is no visible signage or security fencing.",/Users/justinfagan/dev/reseller-intel/facility-images/ChIJlzePdlptaYgRXx_z09VKE0Q.jpg,2026-03-30T15:52:14.379771
ChIJhZ4HwtMTaYgRqwu0TvkFo5I,Box truck repair shop,"3811 Cane Run Rd, Louisville, KY 40211, USA",38.2143027,-85.8186041,3.2,2.5,3,6,0,0,6,6,False,True,False,repair_shop,"The facility has three buildings and a fenced perimeter. There are several service bays visible, suggesting a repair shop. The lot appears somewhat unorganized and there are no trucks or trailers visible in the lot.",/Users/justinfagan/dev/reseller-intel/facility-images/ChIJhZ4HwtMTaYgRqwu0TvkFo5I.jpg,2026-03-30T15:52:17.627632
ChIJj4MAW4oMaYgRgcCsS3SsKRA,"All-State Ford Truck Sales, LLC.","1357 Gardiner Ln, Louisville, KY 40213, USA",38.197863,-85.7023062,3.2,8.5,4,20,100,50,7,7,False,True,True,dealer,"This facility appears to be a commercial truck dealership with a large inventory of trucks and trailers. The lot is generally organized with dedicated parking areas. There is security fencing around the perimeter, but signage is not visible from the satellite imagery.",/Users/justinfagan/dev/reseller-intel/facility-images/ChIJj4MAW4oMaYgRgcCsS3SsKRA.jpg,2026-03-30T15:52:21.044963
ChIJ6-AayV8NaYgRT9RaxsduOlM,"All-State Ford Truck Sales, LLC. Service","1357 Gardiner Ln, Louisville, KY 40213, USA",38.1974978,-85.70292620000001,3.2,8.5,4,15,75,50,7,7,False,True,True,dealer,"This facility appears to be a truck dealership with a large inventory of trucks and trailers. The lot is generally organized, and the buildings appear to be in decent condition. There is security fencing around the perimeter.",/Users/justinfagan/dev/reseller-intel/facility-images/ChIJ6-AayV8NaYgRT9RaxsduOlM.jpg,2026-03-30T15:52:24.341249
